Which is the capital of Greece?, Athens, Thessaloniki, Patras, Piraeus
Which is the capital of Italy?, Rome, Milan, Palermo, Turin
Which is the capital of Germany?, Berlin, Hamburg, Bremen, Augsburg
Which is the capital of Romania?, Bucharest, Timisoara, Brasov, Bacau
Which is the capital of Bulgaria?, Sofia, Plovdiv, Burgas, Veliko Tarnovo
Which is the capital of United Kingdom?, London, Birmingham, Glasgow, Liverpool
Which is the capital of Spain?, Madrid, Barcelona, Bilbao, Zaragoza
Which is the capital of France?, Paris, Lyon, Nice, Toulouse